{
  "schema_version": "validation-matrix.v1",
  "matrix_prep_sha": "3e17ea0b235a6dbfe8f9e0b0954c105ccb83989c",
  "final_validation_sha": "905b7b750a655daff7cbe73bbf5ad770bf29fce9",
  "inventory_date": "2026-07-22",
  "environment_boundary": "Windows native current-user Issue #85 worktree; deterministic synthetic fixtures and server-managed loopback test hosts only.",
  "active_rows": [
    {
      "row_id": "91-E-085",
      "matrix_schema_version": "validation-matrix.v1",
      "surface": "sanitized-evidence-export",
      "operation": "Config CLI preview/export/result and Local Monitor preview/export/result/archive routes",
      "profiles": {
        "collection": ["config-cli", "local-monitor-http"],
        "content_access": ["sanitized-only"],
        "compatibility": ["sanitized-evidence-bundle.v1"],
        "hook": [],
        "otel": [],
        "binding": ["trusted-owner-snapshot-provider"],
        "restart": ["process-local-result-state"],
        "retention": []
      },
      "requirement_level": "required",
      "applicability": "applicable",
      "applicability_reason": null,
      "versions": {
        "bundle_schema": "sanitized-evidence-bundle.v1",
        "manifest": "sanitized-evidence-manifest.v1",
        "archive": "sanitized-evidence-zip-store.v1"
      },
      "expected_invariant": "The exact candidate provides deterministic source-neutral selection, scanner-gated atomic publication, strict archive inspection, and bounded same-origin loopback HTTP results without server path disclosure.",
      "evidence": [
        {
          "kind": "automated",
          "reference": "Corrected Issue #85 checkpoint: solution build 0 warnings/0 errors; LocalMonitor authority/service/API/archive/scanner 47/47; ConfigCli 3/3; schema and exact golden inspection passed.",
          "compatibility_basis": "Executed from the exact implementation tree committed as the validation SHA; the repository full test command was intentionally deferred for coordinator serialization."
        }
      ],
      "actual_result": "The last recorded validation SHA predates the production SQLite snapshot-provider correction. The working candidate now rejects caller snapshot/record bytes and wires read-only production capture, but this row intentionally remains not_attempted until an exact post-commit validation SHA is recorded.",
      "classification": "not_attempted",
      "severity": "medium",
      "blocker": "An exact post-commit validation SHA has not yet replaced the historical checkpoint, and the coordinator-deferred full solution gate remains outside this lane.",
      "retry_condition": "Record the final commit SHA, rerun the prescribed focused provider/authority/CLI/API/schema/golden checks plus coordinator-owned integrated validation, then update this row from that exact SHA.",
      "unverified_capability": "Unchanged-final-SHA integrated regression result.",
      "owner": "Issue #85 sanitized evidence export",
      "validation_sha": "905b7b750a655daff7cbe73bbf5ad770bf29fce9",
      "validation_date": "2026-07-22",
      "environment_boundary": "Exact candidate build and deterministic synthetic focused tests; no live provider, real telemetry, or remote publication."
    },
    {
      "row_id": "91-S-085",
      "matrix_schema_version": "validation-matrix.v1",
      "surface": "sanitized-evidence-export-scanner",
      "operation": "Fail-closed payload, metadata, manifest, archive, credential, PII, path, and Issue #91 corpus validation",
      "profiles": {
        "collection": ["bundle-create", "bundle-inspect"],
        "content_access": ["sanitized-only", "scanner-failure"],
        "compatibility": ["validation-secret-corpus.v1"],
        "hook": [],
        "otel": [],
        "binding": ["exact-record-dependency"],
        "restart": [],
        "retention": []
      },
      "requirement_level": "required",
      "applicability": "applicable",
      "applicability_reason": null,
      "versions": {
        "scanner": "repository-safe-scanner.v1",
        "corpus": "validation-secret-corpus.v1",
        "checksum": "sha256.v1"
      },
      "expected_invariant": "Every selected payload, manifest, and completed archive fails closed on declared raw, secret, PII, path, marker-transform, canonicalization, inventory, size, and checksum violations without returning success bytes or leaving a partial artifact.",
      "evidence": [
        {
          "kind": "automated",
          "reference": "Corrected Issue #85 authority/service/surface tests passed 47/47 and ConfigCli tests passed 3/3, including Issue #91 marker transformations, caller-injection rejection, producer profiles, strict ZIP/inventory/bounds, and stored-download negatives.",
          "compatibility_basis": "The tests execute the exact repository corpus, scanner, manifest validator, archive inspector, and publication implementation at the validation SHA."
        }
      ],
      "actual_result": "The recorded failed result belongs to the historical checkpoint. The working candidate adds the production provider, shared #59/#80 consumers, canonical #58 bytes, bounded opaque alert descriptors, and expanded scanner/archive negatives, but no passing classification is inherited before exact-SHA validation.",
      "classification": "failed",
      "severity": "high",
      "blocker": "The corrected scanner/provider evidence has not yet been recorded against the final commit SHA.",
      "retry_condition": "Rerun the full focused carrier/provider/scanner/archive matrix at the final SHA and record the result without inheriting the historical failure.",
      "unverified_capability": "Exact-final-SHA scanner and producer-boundary evidence.",
      "owner": "Issue #85 sanitized evidence export",
      "validation_sha": "905b7b750a655daff7cbe73bbf5ad770bf29fce9",
      "validation_date": "2026-07-22",
      "environment_boundary": "Deterministic synthetic repository corpus and generated in-memory/file-system bundles; no general DLP, recursive transformation, encryption, or live-data claim."
    }
  ],
  "future_registry_ref": "docs/specifications/contracts/validation-matrix/v1/future-surface-registry.json",
  "evidence_ledger_refs": [
    "docs/sprints/issue-85-sanitized-export/milestones/M1-sanitized-evidence-export/review.md"
  ],
  "release_decision": {
    "decision": "release_blocked",
    "external_blockers": []
  }
}
