{
  "schema_version": "validation-matrix.v1",
  "matrix_prep_sha": "c02c10ab18553acef1619ce12ec630f4f6f5aa5f",
  "final_validation_sha": "ba4aa770b5691930469510e4c67f5381fe5fbcff",
  "inventory_date": "2026-07-23",
  "environment_boundary": "Exact functional SHA on Windows x64 with deterministic synthetic raw records, disposable SQLite databases and retained namespaces, loopback-only test hosts, and repository-local Playwright Chromium; no real content-enabled producer capture is authorized or claimed.",
  "active_rows": [
    {
      "row_id": "91-R-087",
      "matrix_schema_version": "validation-matrix.v1",
      "surface": "raw-local-replay",
      "operation": "Exact raw export, strict archive inspection, isolated deterministic replay, and same-ID idempotent result",
      "profiles": {
        "collection": ["config-cli", "local-monitor-http"],
        "content_access": ["raw-default", "sanitized-only-denied"],
        "compatibility": ["raw-local-replay-bundle.v1", "source-versioned"],
        "hook": [],
        "otel": ["stored-raw-otlp"],
        "binding": ["exact-session-trace-raw-record", "composite-operation-lease"],
        "restart": ["retained-namespace-recovery"],
        "retention": ["sensitive-bundle-7d", "reader-and-operation-leases"]
      },
      "requirement_level": "required",
      "applicability": "applicable",
      "applicability_reason": null,
      "versions": {
        "candidate": "ba4aa770b5691930469510e4c67f5381fe5fbcff",
        "bundle_schema": "raw-local-replay-bundle.v1",
        "manifest": "raw-local-replay-manifest.v1",
        "normalization": "raw-measurement-normalization.v1",
        "projection": "raw-replay-monitor-projection.v1",
        "dashboard": "raw-replay-dashboard.v1"
      },
      "expected_invariant": "One preview-bound, consented, exact Retention-leased snapshot produces a strictly inspectable deterministic archive and an isolated retained replay without changing live raw, Session, projection, analysis, or evidence stores or invoking an external model.",
      "evidence": [
        {
          "kind": "automated",
          "reference": "docs/sprints/issue-87-raw-replay/README.md#candidate-pinned-validation",
          "compatibility_basis": "Exact-candidate CLI, archive, SQLite snapshot, replay engine, retention lease, loopback route, and full-solution tests used deterministic synthetic records and disposable local state."
        }
      ],
      "actual_result": "At the exact functional candidate, Config CLI RawReplay passed 52/52, Local Monitor RawReplay passed 25/25, build passed with zero warnings/errors, Playwright bootstrap passed, and the exact full solution retry passed 7966/7966 with zero skips after three unrelated Setup barrier cases passed 3/3 in isolated diagnosis.",
      "classification": "passed",
      "severity": "none",
      "blocker": null,
      "retry_condition": null,
      "unverified_capability": null,
      "owner": "Issue #87 raw local replay",
      "validation_sha": "ba4aa770b5691930469510e4c67f5381fe5fbcff",
      "validation_date": "2026-07-23",
      "environment_boundary": "Windows x64 disposable local databases, isolated retained namespaces, loopback hosts, and deterministic synthetic raw records; no raw archive, sensitive path, or content value is recorded."
    },
    {
      "row_id": "91-S-087",
      "matrix_schema_version": "validation-matrix.v1",
      "surface": "raw-local-replay-security-and-cleanup",
      "operation": "Consent, sanitized-only denial, credential rejection, no-leak errors, source/version conflicts, Retention capture recovery, leases, and physical cleanup",
      "profiles": {
        "collection": ["bundle-create", "bundle-inspect", "local-monitor-http"],
        "content_access": ["raw-default", "sanitized-only-denied", "credential-rejected"],
        "compatibility": ["supported", "version-mismatch", "archive-corrupt"],
        "hook": [],
        "otel": [],
        "binding": ["exact-source-id", "no-heuristic-session-merge"],
        "restart": ["capture-journal-recovery", "cleanup-retry"],
        "retention": ["sensitive-bundle-7d", "read-denied", "cleanup-leased"]
      },
      "requirement_level": "required",
      "applicability": "applicable",
      "applicability_reason": null,
      "versions": {
        "candidate": "ba4aa770b5691930469510e4c67f5381fe5fbcff",
        "archive": "raw-local-replay-zip-store.v1",
        "checksum": "sha256.v1",
        "credential_scan": "raw-replay-credential-scan.v1",
        "retention_policy": "sensitive-bundle-7d"
      },
      "expected_invariant": "Every raw operation fails closed before publication on consent, profile, selection, archive, inventory, checksum, credential, conflict, or version failure; cleanup uses only the existing exact-owned sensitive-bundle path and never targets the caller archive or live evidence.",
      "evidence": [
        {
          "kind": "automated",
          "reference": "docs/sprints/issue-87-raw-replay/README.md#candidate-pinned-validation",
          "compatibility_basis": "Candidate-pinned malformed, corrupt, traversal, oversize, credential, source/version, consent, sanitized-only, staging recovery, lease, and cleanup cases ran with the repository secret corpus and disposable artifacts."
        }
      ],
      "actual_result": "The exact candidate passed consent/profile separation, normal-export non-leakage, archive and checksum validation, credential rejection, source/version conflict, no-heuristic identity, isolated staging, restart recovery, idempotency, cleanup, route security, repository mirror, and evidence scan gates.",
      "classification": "passed",
      "severity": "none",
      "blocker": null,
      "retry_condition": null,
      "unverified_capability": null,
      "owner": "Issue #87 raw local replay",
      "validation_sha": "ba4aa770b5691930469510e4c67f5381fe5fbcff",
      "validation_date": "2026-07-23",
      "environment_boundary": "Repository synthetic secret corpus, disposable local archive and staging roots, sanitized HTTP assertions, and committed evidence text only; temporary raw artifacts were deleted and never treated as repository-safe."
    },
    {
      "row_id": "91-L-087",
      "matrix_schema_version": "validation-matrix.v1",
      "surface": "raw-local-replay-live-content",
      "operation": "Content-authorized real local producer capture through exact export and isolated replay",
      "profiles": {
        "collection": ["local-monitor-http"],
        "content_access": ["content-authorized"],
        "compatibility": ["source-versioned"],
        "hook": [],
        "otel": ["real-source-producer"],
        "binding": ["exact-session-trace-raw-record"],
        "restart": ["retained-namespace-recovery"],
        "retention": ["sensitive-bundle-7d"]
      },
      "requirement_level": "required",
      "applicability": "applicable",
      "applicability_reason": null,
      "versions": {
        "candidate": "ba4aa770b5691930469510e4c67f5381fe5fbcff",
        "bundle_schema": "raw-local-replay-bundle.v1",
        "credential_scan": "raw-replay-credential-scan.v1"
      },
      "expected_invariant": "With separate operator authorization, one real content-enabled local source can be selected exactly, exported with truthful provenance, replayed only in an isolated retained namespace, and inspected without raw values entering repository-safe evidence.",
      "evidence": [
        {
          "kind": "live",
          "reference": "Not executed on 2026-07-23: content-enabled live capture was not authorized and OTEL_LOG_USER_PROMPTS=1 was not enabled.",
          "compatibility_basis": "The raw-local-replay contract requires separate operator authorization; synthetic automated coverage cannot establish the real producer content/provenance behavior."
        }
      ],
      "actual_result": "The live operation stopped before producer configuration or raw capture. No raw data, credential, local path, or reversible identifier was recorded.",
      "classification": "blocked_external",
      "severity": "medium",
      "blocker": "No operator authorization was provided for content-enabled real-source capture.",
      "retry_condition": "An operator explicitly authorizes a bounded local content-enabled producer run and repository-safe evidence handling for the exact candidate SHA.",
      "unverified_capability": "Real producer content/provenance preservation through exact export, isolated replay, restart recovery, and cleanup without repository-safe leakage.",
      "owner": "Issue #87 raw local replay",
      "validation_sha": "ba4aa770b5691930469510e4c67f5381fe5fbcff",
      "validation_date": "2026-07-23",
      "environment_boundary": "No content-enabled producer process, live raw payload capture, external model, remote endpoint, or shared artifact was used."
    }
  ],
  "future_registry_ref": "docs/specifications/contracts/validation-matrix/v1/future-surface-registry.json",
  "evidence_ledger_refs": [
    "docs/sprints/issue-87-raw-replay/README.md",
    "docs/specifications/contracts/raw-local-replay/v1/issue-91-validation-handoff.json"
  ],
  "release_decision": {
    "decision": "release_ready_with_external_blockers",
    "external_blockers": [
      {
        "row_id": "91-L-087",
        "severity": "medium",
        "blocker": "No operator authorization was provided for content-enabled real-source capture.",
        "retry_condition": "An operator explicitly authorizes a bounded local content-enabled producer run and repository-safe evidence handling for the exact candidate SHA.",
        "unverified_capability": "Real producer content/provenance preservation through exact export, isolated replay, restart recovery, and cleanup without repository-safe leakage."
      }
    ]
  }
}
